Welches Gewebe erscheint leuchtend rot bei einer Safranin-Astrablau-Faerbung?;Phloem;Parenchym;Kollenchym ;Nichts
Wofuer sind die Muster der Jahresringe eines Baumes hilfreich?;Gravitropie;Homorrhizie;Dendrochronologie;Nichts
Woraus besteht die Mittelamelle?;Cutikula;Cytoplasma;Carrageen ;Nichts
Welches gewebe gehoert nicht zur Wurzel?;Rhizodermes ;Hypodermis ;Rindeparenchym;Nichts
Was ist keine Borkenart?;Ringborke ;Streifenborke ;Schuppenborke ;Nichts
Was findet man NICHT in einem Nadelblatt?;Endodermis ;Transfusionsgewebe;Xylem;Nichts
Was gehoert  zum Periderm?;Phoellem ;Phloem ;Phosgen ;Nichts
Was ist der Aristolochia-Typ?;Eichen-Typ;Pfeifenputzer-Typ;Linden-Typ;Nichts
Was sind Meristeme?;Abschlussgewebe ;Festigungsgewebe ;Speichergewebe ;Nichts
Was ist keine Methode der Mikroskopie?;Schiefe Beleuchtung ;Phasenkontrast ;Dunkelfeld MiKrospkopie;Nichts
Was ist keine Meristem Art?;Restmeristme ;Folgemeristme ;Meristemoide;Nichts
Was ist ein Festigungsgewebe?;Siebzellen ;Markparenchym;Phloem ;Nichts
Welches Gewebe findest du im Blatt eines Helleborus niger?;Harzkanal ;Holzstrahl;Eckenkollenchym;Nichts
Was findet man nicht in einem Leitbuendel?;Tracheen ;Phloem ;Xylem;Nichts
Welches Gewebe gibt es nicht in einem Taubnessel Querschnitt?;Hypodermis ;Rindenparenchym;Eckenkollenchym;Nichts
Was kommt nicht in einer Zwiebelzelle vor?;Vakuole;Zellkern;Cytoplasma;Nichts
Welche Zelle gibt es nicht in einer Geranie?;Sklerenchym;Rindenparenchym;Epideremis ;Nichts
Was kommt nicht in einer Tulpe vor?;Rindenparenchym;Leitbuendel;Eckenkollenchym;Nichts
Was kommt in einem Nadelblatt vor? ;Phosgen ;Markparenchym;Eckenkollenchym;Nichts
